{"$schema":"./nautilus-sandbox-dependency-lock-v1.schema.json","authority":{"broker_requests_allowed":false,"credentials_allowed":false,"live_adapter_allowed":false,"network_allowed_during_sandbox_runtime":false,"production_activation":false,"production_state_writes_allowed":false,"real_orders_allowed":false,"runtime_install_authorized":false},"dependency_lock_hash":"eea3232a6494dad9500d8391234193222bc97a6992ba183c347e3a0f883e022d","dependency_lock_id":"nautilus_sandbox_dependency_lock_068d138779fecabfb37fdfb0823e2025a532c835c2be01f413f8069284e2da09","license":{"expression":"LGPL-3.0-or-later","git_blob":"5550e2db15f239ea8d3cf54bfa3b035eab8d3174","path":"LICENSE","sha256":"ee907919ec88c9c017b1f8b608db20960b6598aefcc4fe58820bde955d65ed3c","size":7651},"package":{"development_status":"BETA","name":"nautilus_trader","official_tag":"v1.227.0","peeled_commit":"280ae1762df51a492a4ce71506a40b5c8706def5","requires_python":">=3.12,<3.15","tag_object":"0ccb5b55879c072a6e07fc7cbe5297c53c378107","version":"1.227.0"},"platform":{"machine":"arm64","minimum_version":"15.0","observed_compatible_machine":"macOS 15.7.5 arm64 CPython 3.12.13","operating_system":"macOS","python":"3.12"},"schema_version":"1.0.0","status":"DEPENDENCY_LOCK_VERIFIED_SANDBOX_ONLY","transitive_lock":{"distributions":[{"filename":"click-8.4.2-py3-none-any.whl","name":"click","sha256":"e6f9f66136c816745b9d65817da91d61d957fb16e02e4dcd0552553c5a197b76","size":119243,"source_origin":"https://files.pythonhosted.org","version":"8.4.2"},{"filename":"click-8.4.2.tar.gz","name":"click","sha256":"9a6cea6e60b17ebe0a44c5cc636d94f09bd66142c1cd7d8b4cd731c4917a15f6","size":338000,"source_origin":"https://files.pythonhosted.org","version":"8.4.2"},{"filename":"colorama-0.4.6-py2.py3-none-any.whl","name":"colorama","sha256":"4f1d9991f5acc0ca119f9d443620b77f9d6b33703e51011c16baf57afb285fc6","size":25335,"source_origin":"https://files.pythonhosted.org","version":"0.4.6"},{"filename":"colorama-0.4.6.tar.gz","name":"colorama","sha256":"08695f5cb7ed6e0531a20572697297273c47b8cae5a63ffc6d6ed5c201be6e44","size":27697,"source_origin":"https://files.pythonhosted.org","version":"0.4.6"},{"filename":"fsspec-2026.2.0-py3-none-any.whl","name":"fsspec","sha256":"98de475b5cb3bd66bedd5c4679e87b4fdfe1a3bf4d707b151b3c07e58c9a2437","size":202505,"source_origin":"https://files.pythonhosted.org","version":"2026.2.0"},{"filename":"fsspec-2026.2.0.tar.gz","name":"fsspec","sha256":"6544e34b16869f5aacd5b90bdf1a71acb37792ea3ddf6125ee69a22a53fb8bff","size":313441,"source_origin":"https://files.pythonhosted.org","version":"2026.2.0"},{"filename":"msgspec-0.21.1-cp312-cp312-macosx_10_13_x86_64.whl","name":"msgspec","sha256":"d4248cf0b6129b7d230eacd493c17cc2d4f3989f3bb7f633a928a85b7dcfa251","size":196188,"source_origin":"https://files.pythonhosted.org","version":"0.21.1"},{"filename":"msgspec-0.21.1-cp312-cp312-macosx_11_0_arm64.whl","name":"msgspec","sha256":"5102c7e9b3acff82178449b85006d96310e690291bb1ea0142f1b24bcb8aabcb","size":188473,"source_origin":"https://files.pythonhosted.org","version":"0.21.1"},{"filename":"msgspec-0.21.1-cp312-cp312-manylinux2014_aarch64.manylinux_2_17_aarch64.manylinux_2_28_aarch64.whl","name":"msgspec","sha256":"846758412e9518252b2ac9bffd6f0e54d9ff614f5f9488df7749f81ff5c80920","size":218871,"source_origin":"https://files.pythonhosted.org","version":"0.21.1"},{"filename":"msgspec-0.21.1-cp312-cp312-manylinux2014_x86_64.manylinux_2_17_x86_64.manylinux_2_28_x86_64.whl","name":"msgspec","sha256":"21995e74b5c598c2e004110ad66ec7f1b8c20bf2bcf3b2de8fd9a3094422d3ff","size":225025,"source_origin":"https://files.pythonhosted.org","version":"0.21.1"},{"filename":"msgspec-0.21.1-cp312-cp312-musllinux_1_2_aarch64.whl","name":"msgspec","sha256":"6129f0cca52992e898fd5344187f7c8127b63d810b2fd73e36fca73b4c6475ee","size":222672,"source_origin":"https://files.pythonhosted.org","version":"0.21.1"},{"filename":"msgspec-0.21.1-cp312-cp312-musllinux_1_2_x86_64.whl","name":"msgspec","sha256":"ef3ec2296248d1f8b9231acb051b6d471dfde8f21819e86c9adaaa9f42918521","size":227303,"source_origin":"https://files.pythonhosted.org","version":"0.21.1"},{"filename":"msgspec-0.21.1-cp312-cp312-win_amd64.whl","name":"msgspec","sha256":"d4ab834a054c6f0cbeef6df9e7e1b33d5f1bc7b86dea1d2fd7cad003873e783d","size":190017,"source_origin":"https://files.pythonhosted.org","version":"0.21.1"},{"filename":"msgspec-0.21.1-cp312-cp312-win_arm64.whl","name":"msgspec","sha256":"628aaa35c74950a8c59da330d7e98917e1c7188f983745782027748ee4ca573e","size":175345,"source_origin":"https://files.pythonhosted.org","version":"0.21.1"},{"filename":"msgspec-0.21.1.tar.gz","name":"msgspec","sha256":"2313508e394b0d208f8f56892ca9b2799e2561329de9763b19619595a6c0f72c","size":319193,"source_origin":"https://files.pythonhosted.org","version":"0.21.1"},{"filename":"nautilus_trader-1.227.0-cp312-cp312-macosx_15_0_arm64.whl","name":"nautilus-trader","sha256":"735fbbc0737be8f945ee641aeb0dbf0ea6b4c6111f11f10c244fe198f8158953","size":145812901,"source_origin":"https://files.pythonhosted.org","version":"1.227.0"},{"filename":"nautilus_trader-1.227.0-cp312-cp312-manylinux_2_35_aarch64.whl","name":"nautilus-trader","sha256":"a557ae2e109c5a7f38e6115aff123d3a793c111f1712e333befe218f47d06187","size":163211165,"source_origin":"https://files.pythonhosted.org","version":"1.227.0"},{"filename":"nautilus_trader-1.227.0-cp312-cp312-manylinux_2_35_x86_64.whl","name":"nautilus-trader","sha256":"19482db9166560fc415019ddb1d7775c70b6b268bd0629da5c1ee20d951bf3d8","size":171152190,"source_origin":"https://files.pythonhosted.org","version":"1.227.0"},{"filename":"nautilus_trader-1.227.0-cp312-cp312-win_amd64.whl","name":"nautilus-trader","sha256":"777bd0693abceebd1cfc835ce1b411fe7f448cb8288a37e0db16753e6a4c9e7d","size":101843474,"source_origin":"https://files.pythonhosted.org","version":"1.227.0"},{"filename":"nautilus_trader-1.227.0.tar.gz","name":"nautilus-trader","sha256":"fbb9c1194f1f50f14fbf0933c35b81e05ea522ab944f584be3c75efb36887ca7","size":7571723,"source_origin":"https://files.pythonhosted.org","version":"1.227.0"},{"filename":"numpy-2.5.1-cp312-cp312-macosx_10_13_x86_64.whl","name":"numpy","sha256":"2c889b56fe48b1018f764b0eec8df59ab654e9148aa91faa12596043500de277","size":16801574,"source_origin":"https://files.pythonhosted.org","version":"2.5.1"},{"filename":"numpy-2.5.1-cp312-cp312-macosx_11_0_arm64.whl","name":"numpy","sha256":"ab451b59c5643c570974c43aef780703ef1d3b4965d2be07afd530615a9358d1","size":11772250,"source_origin":"https://files.pythonhosted.org","version":"2.5.1"},{"filename":"numpy-2.5.1-cp312-cp312-macosx_14_0_arm64.whl","name":"numpy","sha256":"78798bd5b9ad744056af8efa90e3b9ddaa53272a0848a483084a1cc0a13b2dc0","size":5331516,"source_origin":"https://files.pythonhosted.org","version":"2.5.1"},{"filename":"numpy-2.5.1-cp312-cp312-macosx_14_0_x86_64.whl","name":"numpy","sha256":"2ae0ca40bcb22d6ba59c1dfd5446f49940b0f2d821fde133f10dda11f816b84e","size":6664863,"source_origin":"https://files.pythonhosted.org","version":"2.5.1"},{"filename":"numpy-2.5.1-cp312-cp312-manylinux_2_27_aarch64.manylinux_2_28_aarch64.whl","name":"numpy","sha256":"61ac47e772e6b8ea489e1d2f441a34c5c3ac17327e7ce294cbdf535795ad4e75","size":15167977,"source_origin":"https://files.pythonhosted.org","version":"2.5.1"},{"filename":"numpy-2.5.1-cp312-cp312-manylinux_2_27_x86_64.manylinux_2_28_x86_64.whl","name":"numpy","sha256":"59fda5e192b570217ec2580c96f00e9a7e12ef6866a900eb089b62c1a32545ca","size":16672469,"source_origin":"https://files.pythonhosted.org","version":"2.5.1"},{"filename":"numpy-2.5.1-cp312-cp312-musllinux_1_2_aarch64.whl","name":"numpy","sha256":"f7119ebff1a9829e9f431a4f9d28e703023bb6b9fe7c8f724467dbfc27c94ab3","size":16527531,"source_origin":"https://files.pythonhosted.org","version":"2.5.1"},{"filename":"numpy-2.5.1-cp312-cp312-musllinux_1_2_x86_64.whl","name":"numpy","sha256":"e824c2acf8862052246be5a44c15da1777940c60d010dd2aab897824d9c430f9","size":18431940,"source_origin":"https://files.pythonhosted.org","version":"2.5.1"},{"filename":"numpy-2.5.1-cp312-cp312-win32.whl","name":"numpy","sha256":"08d60c810432eb83360958dea0999ac4cfb94531ea8efcbf0b7f277c2068aeb2","size":6066764,"source_origin":"https://files.pythonhosted.org","version":"2.5.1"},{"filename":"numpy-2.5.1-cp312-cp312-win_amd64.whl","name":"numpy","sha256":"f7d60026c0bdb1380e83bfa7a0419c4577ee4b9a08880afcb6dadeb74c649fa2","size":12430966,"source_origin":"https://files.pythonhosted.org","version":"2.5.1"},{"filename":"numpy-2.5.1-cp312-cp312-win_arm64.whl","name":"numpy","sha256":"17a25e09640602e10bc8de0e6fa2b3fd68eedd84ba6d7842dc8f32f9ab87bd0b","size":10350488,"source_origin":"https://files.pythonhosted.org","version":"2.5.1"},{"filename":"numpy-2.5.1.tar.gz","name":"numpy","sha256":"a48a113e6afea91f5608793bafa7ef2ad481fefbda87ec5069f483de61cb9fa3","size":20755553,"source_origin":"https://files.pythonhosted.org","version":"2.5.1"},{"filename":"pandas-2.3.3-cp312-cp312-macosx_10_13_x86_64.whl","name":"pandas","sha256":"6d21f6d74eb1725c2efaa71a2bfc661a0689579b58e9c0ca58a739ff0b002b53","size":11597846,"source_origin":"https://files.pythonhosted.org","version":"2.3.3"},{"filename":"pandas-2.3.3-cp312-cp312-macosx_11_0_arm64.whl","name":"pandas","sha256":"3fd2f887589c7aa868e02632612ba39acb0b8948faf5cc58f0850e165bd46f35","size":10729618,"source_origin":"https://files.pythonhosted.org","version":"2.3.3"},{"filename":"pandas-2.3.3-cp312-cp312-manylinux_2_24_aarch64.manylinux_2_28_aarch64.whl","name":"pandas","sha256":"ecaf1e12bdc03c86ad4a7ea848d66c685cb6851d807a26aa245ca3d2017a1908","size":11737212,"source_origin":"https://files.pythonhosted.org","version":"2.3.3"},{"filename":"pandas-2.3.3-cp312-cp312-manylinux_2_24_x86_64.manylinux_2_28_x86_64.whl","name":"pandas","sha256":"b3d11d2fda7eb164ef27ffc14b4fcab16a80e1ce67e9f57e19ec0afaf715ba89","size":12362693,"source_origin":"https://files.pythonhosted.org","version":"2.3.3"},{"filename":"pandas-2.3.3-cp312-cp312-musllinux_1_2_aarch64.whl","name":"pandas","sha256":"a